{
  "reflex_id": "RM-0201",
  "version": "reflex_memory_v0_2",
  "status": "accepted",
  "source_candidate_id": "RMC-0201",
  "source_chronology_event_ids": [
    "CHR-2026-08-06-103"
  ],
  "created_at": "2026-08-06T16:00:00Z",
  "reviewed_at": "2026-08-06T16:10:00Z",
  "reviewed_by": "synthetic_cco_review",
  "accepted_at": "2026-08-06T16:20:00Z",
  "accepted_by": "synthetic_local_governance_authority",
  "source_state": {
    "classification": "cco_reconciled",
    "limitations": [
      "This fixture is synthetic specification evidence only.",
      "The accepted lesson is bounded to recurring source conflicts in the stated action class."
    ]
  },
  "trigger_pattern": "source_state_conflict",
  "stress_type": "source_integrity_risk",
  "boundary_risk": "A recurring custodian and treasury source conflict may be omitted from future review context.",
  "review_posture_effect": "require_source_reconciliation_context",
  "evidence_refs": [
    "synthetic://reviewed-chronology/stablecoin-source-conflict-103",
    "synthetic://candidate/RMC-0201",
    "synthetic://review/RMC-0201",
    "synthetic://acceptance/RMC-0201"
  ],
  "expiration_or_review_after": "2026-11-06",
  "knowledge_class": "source_pattern",
  "action_class": "stablecoin_treasury_source_conflict_review",
  "applicability_conditions": [
    "same_bounded_action_class",
    "materially_similar_source_authority_conflict"
  ],
  "material_distinctions": [
    "different_custodians_or_authority_paths_require_independent_review"
  ],
  "known_exceptions": [
    "documented_provider_incidents_may_require_exception_only_treatment"
  ],
  "contradictory_cases": [],
  "unresolved_conditions": [
    "current_source_age_and_proposal_version_must_be_compared"
  ],
  "epistemic_status": "source_supported",
  "authority_treatment": "accepted_for_review_use",
  "precedent_treatment": "analogous",
  "supersedes": [],
  "superseded_by": null,
  "authority_effect": "none",
  "non_authority_statement": "This accepted Reflex Memory entry does not approve, deny, authorize, create authority, or establish binding precedent; local authority decides."
}
